<!DOCTYPE Job SYSTEM "job.dtd">
<Job ShortName="Mrkt">
    <Description>
        She will buy and sell things.
    </Description>

    <Config BaseWages="20">
        <Enjoyment PrimaryAction="Social"/>
    </Config>

    <Performance>
        <Factor Stat="Charisma" Weight="3"/>
        <Factor Stat="Confidence" Weight="3"/>
        <Factor Stat="Intelligence" Weight="2"/>
        <Factor Stat="Fame" Weight="2"/>
        <Factor Skill="Farming" Weight="2"/>

        <!-- good traits -->
        <Trait Name="Charismatic" Value="15"/>
        <Trait Name="Sexy Air" Value="5"/>
        <Trait Name="Cool Person" Value="10"/>  <!-- people love to be around her -->
        <Trait Name="Cute" Value="5"/>
        <Trait Name="Charming" Value="15"/>  <!-- people like charming people -->
        <Trait Name="Quick Learner" Value="5"/>
        <Trait Name="Psychic" Value="10"/>

        <!-- bad traits -->
        <Trait Name="Dependent" Value="-50"/> <!-- needs others to do the job -->
        <Trait Name="Clumsy" Value="-20"/> <!-- spills food and breaks things often -->
        <Trait Name="Aggressive" Value="-20"/> <!-- gets mad easy -->
        <Trait Name="Nervous" Value="-30"/> <!-- don't like to be around people -->
        <Trait Name="Meek" Value="-20"/>
    </Performance>

    <Gains XP="10" Skill="3">
        <Stat Name="Charisma" Weight="1" />
        <Stat Name="Confidence" Weight="1" />
        <Stat Name="Fame" Weight="1" />

        <GainTrait Trait="Charismatic">
            <TraitChangeAmount Value="40" Chance="50">
                <TraitChangeCondition What="Confidence" Lower="20" Upper="50"/>
                <TraitChangeCondition What="Performance" Lower="20" Upper="50"/>
                <TraitChangeCondition What="Charisma" Lower="10" Upper="40"/>
            </TraitChangeAmount>
            <Text>${name} has been selling long enough that she has learned to be more Charismatic.</Text>
        </GainTrait>

        <GainTrait Trait="Psychic">
            <TraitChangeAmount Value="100" Chance="10">
                <TraitChangeCondition What="JobPerformance" Lower="180" Upper="220"/>
            </TraitChangeAmount>
            <Text>${name} has learned to size up the buyers so well that you'd almost think she was Psychic.</Text>
        </GainTrait>

        <LoseTrait Trait="Nervous">
            <TraitChangeAmount Value="40" Chance="33">
                <TraitChangeCondition What="Confidence" Lower="10" Upper="40"/>
            </TraitChangeAmount>
            <Text>${name} seems to finally be getting over her Nervousness.</Text>
        </LoseTrait>

        <LoseTrait Trait="Shy">
            <TraitChangeAmount Value="40" Chance="50">
                <TraitChangeCondition What="Confidence" Lower="0" Upper="33"/>
            </TraitChangeAmount>
            <Text>${name} has been selling for so long now that her confidence is super high, and she is no longer Shy.</Text>
        </LoseTrait>

        <LoseTrait Trait="Meek">
            <TraitChangeAmount Value="60" Chance="50">
                <TraitChangeCondition What="Confidence" Lower="0" Upper="33"/>
            </TraitChangeAmount>
            <Text>${name}'s having to work with customers every day has forced her to get over her Meekness.</Text>
        </LoseTrait>
    </Gains>

    <Messages>
        <Message Name="work">
            <Text>${name} worked as a marketer on the farm.</Text>
        </Message>
        <Message Name="refuse">
            <Text>${name} refused to work during the ${shift} shift.</Text>
        </Message>

        <Message Name="work.perfect">
            <Text>She must be perfect at this.</Text>
        </Message>
        <Message Name="work.great">
            <Text>She's unbelievable at this and is always getting praised by people for her work.</Text>
        </Message>
        <Message Name="work.good">
            <Text>She's good at this job and gets praised by people often.</Text>
        </Message>
        <Message Name="work.ok">
            <Text>She made a few mistakes but overall she is okay at this.</Text>
        </Message>
        <Message Name="work.bad">
            <Text>She was nervous and made a few mistakes. She isn't that good at this.</Text>
        </Message>
        <Message Name="work.worst">
            <Text>She was nervous and constantly making mistakes. She really isn't very good at this job.</Text>
        </Message>
    </Messages>
</Job>
