<!DOCTYPE Job SYSTEM "job.dtd">
<Job ShortName="Rcrt" Title="Recruiter">
    <Description>
        She will go out and try and recruit girls for you.
    </Description>

    <Config Shift="full" BaseWages="100">
        <Enjoyment PrimaryAction="Social" />
        <Obedience Difficulty="15" Fear="5" Dignity="90" />
    </Config>

    <Requirements FreeOnly="1" />

    <Performance>
        <Factor Stat="PCLove" Weight="1" />
        <Factor Stat="Charisma" Weight="1" />
    </Performance>

    <Gains XP="15" Skill="3">
        <Skill Name="Service" Weight="1"/>
        <Skill Name="Lesbian" Weight="1"/>
        <Stat Name="Charisma" Weight="1" />
        <Stat Name="Intelligence" Weight="1" />

        <GainTrait Trait="Charismatic">
            <TraitChangeAmount Value="40" Chance="50">
                <TraitChangeCondition What="Confidence" Lower="20" Upper="50"/>
                <TraitChangeCondition What="Performance" Lower="20" Upper="50"/>
                <TraitChangeCondition What="Charisma" Lower="10" Upper="40"/>
            </TraitChangeAmount>
            <Text>Dealing with people all day has made ${name} more Charismatic.</Text>
        </GainTrait>

        <GainTrait Trait="Charismatic">
            <TraitChangeAmount Value="50" Chance="10">
                <TraitChangeCondition What="JobPerformance" Lower="150" Upper="200"/>
            </TraitChangeAmount>
            <Text> ${name} has been doing this for so long it's as if she can read minds now.</Text>
        </GainTrait>

        <LoseTrait Trait="Nervous">
            <TraitChangeAmount Value="60" Chance="50">
                <TraitChangeCondition What="Confidence" Lower="10" Upper="40"/>
            </TraitChangeAmount>
            <Text>${name} seems to finally be getting over her Nervousness.</Text>
        </LoseTrait>
    </Gains>

    <Messages>
        <Message Name="work">
            <Text>${name} worked trying to recruit girls for you.</Text>
        </Message>
        <Message Name="refuse">
            <Text>${name} refused to work during the ${shift} shift.</Text>
        </Message>

        <Message Name="work.perfect">
            <Text>She must be the perfect recruiter."</Text>
        </Message>
        <Message Name="work.great">
            <Text>She's unbelievable at this.</Text>
        </Message>
        <Message Name="work.good">
            <Text>"She's good at this job.</Text>
        </Message>
        <Message Name="work.ok">
            <Text>She made a few mistakes but overall she is okay at this.</Text>
        </Message>
        <Message Name="work.bad">
            <Text>She was nervous and made a few mistakes. She isn't that good at this.</Text>
        </Message>
        <Message Name="work.worst">
            <Text>She was nervous and constantly making mistakes. She really isn't very good at this job.</Text>
        </Message>

        <Message Name="shift.good">
            <Text>She had a pleasant time working.</Text>
        </Message>
        <Message Name="shift.bad">
            <Text>Some of the people abused her during the shift.</Text>
        </Message>
        <Message Name="shift.neutral">
            <Text>Otherwise, the shift passed uneventfully.</Text>
        </Message>
    </Messages>
</Job>
