<!DOCTYPE Job SYSTEM "job.dtd">
<Job ShortName="CS" Title="Customer Service">
    <Description>
        She will look after customer needs.
    </Description>

    <Config BaseWages="50">
        <Enjoyment PrimaryAction="Social" SecondaryAction="Service"/>
        <Obedience Difficulty="25" Fear="5" Dignity="80" />
    </Config>

    <Performance>
        <Factor Stat="Beauty" Weight="2"/>
        <Factor Stat="Confidence" Weight="2"/>
        <Factor Stat="Spirit" Weight="2"/>
        <Factor Skill="Performance" Weight="2"/>

        <Factor Skill="Service" Weight="4"/>
        <Factor Stat="Charisma" Weight="4"/>

        <Mod>work.customerservice</Mod>
    </Performance>

    <Gains XP="10" Skill="3">
        <Skill Name="Performance" Weight="1" Max="50"/>
        <Stat Name="Spirit" Weight="1" Max="50"/>
        <Skill Name="Service" Weight="1" Max="50"/>
        <Stat Name="Confidence" Weight="1" Max="50"/>

        <GainTrait Trait="Charismatic">
            <TraitChangeAmount Value="40" Chance="50">
                <TraitChangeCondition What="Confidence" Lower="20" Upper="50"/>
                <TraitChangeCondition What="Performance" Lower="20" Upper="50"/>
                <TraitChangeCondition What="JobPerformance" Lower="100" Upper="200"/>
            </TraitChangeAmount>
            <Text>Helping customers on a daily basis has made ${name} more Charismatic.</Text>
        </GainTrait>

        <LoseTrait Trait="Nervous">
            <TraitChangeAmount Value="60" Chance="50">
                <TraitChangeCondition What="Confidence" Lower="10" Upper="40"/>
            </TraitChangeAmount>
            <Text>${name} seems to finally be getting over her shyness. She's not always so Nervous anymore.</Text>
        </LoseTrait>
    </Gains>

    <Messages>
        <Message Name="work">
            <Text>${name} worked as Customer Service.</Text>
        </Message>
        <Message Name="refuse">
            <Text>${name} refused to provide Customer Service in your brothel to${shift}.</Text>
        </Message>
    </Messages>
</Job>
