<!DOCTYPE Job SYSTEM "job.dtd">
<Job ShortName="Cblr">
    <Description>
        She will make shoes and leather items.
    </Description>

    <Performance>
        <Factor Skill="Crafting" Weight="3"/>
        <Factor Skill="Service" Weight="1"/>
        <Factor Skill="Magic" Weight="1"/>
        <Factor Stat="Intelligence" Weight="1"/>
    </Performance>

    <Gains XP="10" Skill="3">
        <Skill Name="Crafting" Weight="3"/>
        <Skill Name="Service" Weight="1"/>
        <Skill Name="Magic" Weight="1"/>
    </Gains>

    <Config DefaultImage="Craft" />

    <Messages>
        <Message Name="work">
            <Text>${name} worked making shoes and other leather items at the arena.</Text>
        </Message>
        <Message Name="refuse">
            <Text>${name} refused to work as a cobbler during the ${shift} shift.</Text>
        </Message>
        <Message Name="repair">
            <Text>"She spent some of her time repairing the Arena's equipment instead of making new stuff.</Text>
        </Message>
        <Message Name="produce">
            <Text>${name} made:</Text>
        </Message>
        <Include>DefaultPerformanceMessages.xml</Include>
    </Messages>
</Job>
