<!DOCTYPE Job SYSTEM "job.dtd">
<Job ShortName="Bchr">
    <Description>
        She will produce food from animals you own.
    </Description>

    <Performance>
        <Factor Skill="AnimalHandling" Weight="2"/>
        <Factor Stat="Strength" Weight="2"/>
        <Factor Skill="Medicine" Weight="1"/>
        <Factor Skill="Cooking" Weight="1"/>
        <Factor Stat="Intelligence" Weight="1"/>

        <!-- good traits -->
        <Trait Name="Quick Learner" Value="5"/>
        <Trait Name="Psychic" Value="10"/>
        <Trait Name="Farmers Daughter" Value="20"/>
        <Trait Name="Country Gal" Value="10"/>

        <!-- bad traits -->
        <Trait Name="Dependent" Value="-50"/> <!-- needs others to do the job -->
        <Trait Name="Clumsy" Value="-20"/> <!-- spills food and breaks things often -->
        <Trait Name="Aggressive" Value="-20"/> <!-- gets mad easy -->
        <Trait Name="Nervous" Value="-30"/> <!-- don't like to be around people -->
        <Trait Name="Meek" Value="-20"/>

        <Trait Name="One Arm" Value="-40"/>
        <Trait Name="One Foot" Value="-20"/>
        <Trait Name="One Hand" Value="-30"/>
        <Trait Name="One Leg" Value="-35"/>
        <Trait Name="No Arms" Value="-125"/>
        <Trait Name="No Feet" Value="-40"/>
        <Trait Name="No Hands" Value="-50"/>
        <Trait Name="No Legs" Value="-75"/>
        <Trait Name="Blind" Value="-30"/>
        <Trait Name="Retarded" Value="-60"/>
        <Trait Name="Smoker" Value="-10"/> <!-- would need smoke breaks -->

        <Trait Name="Alcoholic" Value="-25"/>
        <Trait Name="Fairy Dust Addict" Value="-25"/>
        <Trait Name="Shroud Addict" Value="-25"/>
        <Trait Name="Viras Blood Addict" Value="-25"/>
    </Performance>

    <Gains XP="10" Skill="3">
        <Skill Name="AnimalHandling" Weight="2" />
        <Stat Name="Strength" Weight="2" />
        <Skill Name="Medicine" Weight="1" Max="33" />
        <Skill Name="Cooking" Weight="1" />
        <GainTrait Trait="Chef" Threshold="70" Action="COOKING">
            ${name} has prepared enough food to qualify as a Chef.
        </GainTrait>
    </Gains>

    <Config DefaultImage="Cook" />

    <Messages>
        <Message Name="work">
            <Text>${name} worked as a butcher on the farm.</Text>
        </Message>
        <Message Name="refuse">
            <Text>${name} refused to work as a butcher during the ${shift} shift.</Text>
        </Message>
        <Message Name="repair">
            <Text>She spent some of her time repairing the Farm's equipment instead of making new stuff.</Text>
        </Message>
        <Message Name="produce">
            <Text>${name} made:</Text>
        </Message>
        <Include>DefaultPerformanceMessages.xml</Include>
    </Messages>
</Job>
