<!DOCTYPE Job SYSTEM "job.dtd">
<Job ShortName="CRnc" Title="Catacomb Rancher">
    <Description>
        She will tend to strange beasts.
    </Description>

    <Config DefaultImage="Herd" BaseWages="40" FightingJob="1">
        <Enjoyment BaseEnjoyment="-2" PrimaryAction="Farming" SecondaryAction="Fighting"/>
        <Obedience Difficulty="30" Fear="33" Dignity="60"/>
        <WageFunction>
            <Point Performance="245" Wages="155" />
            <Point Performance="185" Wages="95" />
            <Point Performance="145" Wages="55" />
            <Point Performance="100" Wages="15" />
            <Point Performance="70" Wages="-5" />
            <Point Performance="0" Wages="-15" />
        </WageFunction>
    </Config>

    <Performance>
        <Factor Skill="AnimalHandling" Weight="3"/>
        <Factor Stat="Confidence" Weight="1"/>
        <Factor Stat="Strength" Weight="1"/>
        <Factor Stat="Constitution" Weight="1"/>

        <!-- good traits -->
        <Trait Name="Quick Learner" Value="5"/>
        <Trait Name="Psychic" Value="10"/>
        <Trait Name="Farmers Daughter" Value="30"/>
        <Trait Name="Country Gal" Value="10"/>

        <!-- bad traits -->
        <Trait Name="Dependent" Value="-50"/> <!-- needs others to do the job -->
        <Trait Name="Clumsy" Value="-20"/> <!-- spills food and breaks things often -->
        <Trait Name="Aggressive" Value="-20"/> <!-- gets mad easy -->
        <Trait Name="Nervous" Value="-30"/> <!-- don't like to be around people -->
        <Trait Name="Meek" Value="-20"/>

        <Trait Name="One Arm" Value="-40"/>
        <Trait Name="One Foot" Value="-40"/>
        <Trait Name="One Hand" Value="-30"/>
        <Trait Name="One Leg" Value="-60"/>
        <Trait Name="No Arms" Value="-125"/>
        <Trait Name="No Feet" Value="-60"/>
        <Trait Name="No Hands" Value="-50"/>
        <Trait Name="No Legs" Value="-150"/>
        <Trait Name="Blind" Value="-30"/>
        <Trait Name="Deaf" Value="-15"/>
        <Trait Name="Retarded" Value="-60"/>
        <Trait Name="Smoker" Value="-10"/> <!-- would need smoke breaks -->

        <Trait Name="Alcoholic" Value="-25"/>
        <Trait Name="Fairy Dust Addict" Value="-25"/>
        <Trait Name="Shroud Addict" Value="-25"/>
        <Trait Name="Viras Blood Addict" Value="-25"/>
    </Performance>

    <Gains XP="15" Skill="3">
        <Skill Name="AnimalHandling" Weight="3" />
        <Stat Name="Confidence" Weight="1" />
        <Stat Name="Strength" Weight="1" />
        <Stat Name="Constitution" Weight="1" />

        <LoseTrait Trait="Elegant">
            <TraitChangeAmount Value="100" Chance="50" />
            <Text>Working with dirty, smelly beasts has damaged ${name}'s hair,
                skin and nails making her less Elegant.</Text>
        </LoseTrait>
    </Gains>

    <Messages>
        <Message Name="work">
            <Text>${name} worked as a catacomb rancher on the farm.</Text>
        </Message>
        <Message Name="refuse">
            <Text>${name} refused to work during the ${shift} shift.</Text>
        </Message>

        <Message Name="work.perfect">
            <Text>She must be perfect at this.</Text>
        </Message>
        <Message Name="work.great">
            <Text>She's unbelievable at this and is always getting praised by people for her work.</Text>
        </Message>
        <Message Name="work.good">
            <Text>She's good at this job and gets praised by people often.</Text>
        </Message>
        <Message Name="work.ok">
            <Text>She made a few mistakes but overall she is okay at this.</Text>
        </Message>
        <Message Name="work.bad">
            <Text>She was nervous and made a few mistakes. She isn't that good at this.</Text>
        </Message>
        <Message Name="work.worst">
            <Text>She was nervous and constantly making mistakes. She really isn't very good at this job.</Text>
        </Message>
    </Messages>
</Job>
