<!DOCTYPE Job SYSTEM "job.dtd">
<Job ShortName="FAct">
    <Description>
        She will be the scantily clad heroine in fighting/magical action scenes.
    </Description>

    <Config DefaultImage="Combat">
        <Enjoyment BaseEnjoyment="5" PrimaryAction="Performing" SecondaryAction="Fighting" />
        <Obedience Difficulty="20" Fear="5" Dignity="85"/>
    </Config>

    <Performance>
        <Factor Stat="Charisma" Weight="2"/>
        <Factor Stat="Beauty" Weight="1"/>
        <Factor Stat="Agility" Weight="1"/>
        <Factor Stat="Confidence" Weight="1"/>
        <Factor Skill="Performance" Weight="2"/>

        <Mod>work.actress</Mod>

        <!-- This is currently handled on the C++ side -->
        <!-- Good -->
        <Trait Name="Charismatic" Value="30"/> <!-- Can act -->
        <Trait Name="Incorporeal" Value="20"/> <!-- Can't be hurt -->
        <Trait Name="Construct" Value="20"/>
        <Trait Name="Half-Construct" Value="15"/>
        <Trait Name="Muscular" Value="35"/>
        <Trait Name="Strong" Value="35"/>
        <Trait Name="Tough" Value="30"/>
        <Trait Name="Fleet of Foot" Value="30"/>
        <Trait Name="Agile" Value="30"/>
        <Trait Name="Heroine" Value="20"/> <!-- Exciting -->
        <Trait Name="Brawler" Value="20"/>
        <Trait Name="Dominatrix" Value="20"/>
        <Trait Name="Tsundere" Value="15"/>
        <Trait Name="Yandere" Value="15"/>
        <Trait Name="Fearless" Value="15"/>
        <Trait Name="Iron Will" Value="10"/>

        <!-- Bad -->
        <Trait Name="Fragile" Value="-30"/>    <!-- Tends to get hurt on set -->
        <Trait Name="Delicate" Value="-30"/>
        <Trait Name="Clumsy" Value="-10"/>
        <Trait Name="Dojikko" Value="-15"/>
    </Performance>

    <Gains XP="15" Skill="3">
        <Skill Name="Performance" Weight="4" Max="80"/>
        <Skill Name="Combat" Weight="1" Max="30"/>
        <Stat Name="Agility" Weight="2" Max="50" />
        <Stat Name="Confidence" Weight="1" Max="33" />

        <GainTrait Trait="Brawler" >
            <TraitChangeAmount Value="40" Chance="25">
                <TraitChangeCondition What="JobPerformance" Lower="140" Upper="200" />
            </TraitChangeAmount>
            <Text>She has performed in enough fight scenes that she has become quite a Brawler.</Text>
        </GainTrait>

        <GainTrait Trait="Tough" >
            <TraitChangeAmount Value="40" Chance="20">
                <TraitChangeCondition What="JobPerformance" Lower="150" Upper="200" />
                <TraitChangeCondition What="Strength" Lower="40" Upper="60" />
            </TraitChangeAmount>
            <Text>She has performed in enough fight scenes that she has become quite Tough.</Text>
        </GainTrait>

        <GainTrait Trait="Agile" >
            <TraitChangeAmount Value="40" Chance="15">
                <TraitChangeCondition What="JobPerformance" Lower="160" Upper="200" />
            </TraitChangeAmount>
            <Text>She has performed so many martial arts scenes that she is becoming agile.</Text>
        </GainTrait>

        <GainTrait Trait="Fleet of Foot" >
            <TraitChangeAmount Value="40" Chance="15">
                <TraitChangeCondition What="JobPerformance" Lower="160" Upper="200" />
            </TraitChangeAmount>
            <Text>She has performed so many action scenes that she has become fast on her feet.</Text>
        </GainTrait>

        <GainTrait Trait="Charismatic" >
            <TraitChangeAmount Value="40" Chance="40">
                <TraitChangeCondition What="JobPerformance" Lower="140" Upper="200" />
            </TraitChangeAmount>
            <Text>She has performed in enough movie scenes that she has become Charismatic.</Text>
        </GainTrait>

        <GainTrait Trait="Actress" >
            <TraitChangeAmount Value="40" Chance="50">
                <TraitChangeCondition What="JobPerformance" Lower="100" Upper="200" />
            </TraitChangeAmount>
            <Text>She has performed in enough movie scenes that she has become a good Actress.</Text>
        </GainTrait>

        <GainTrait Trait="Idol" >
            <TraitChangeAmount Value="75" Chance="20">
                <TraitChangeCondition What="JobPerformance" Lower="100" Upper="200" />
                <TraitChangeCondition What="Fame" Lower="50" Upper="100" />
            </TraitChangeAmount>
            <Text>Action hero ${name} has become an Idol, adored by her fans and followers.</Text>
        </GainTrait>

        <GainTrait Trait="Cool Person" >
            <TraitChangeAmount Value="40" Chance="33">
                <TraitChangeCondition What="JobPerformance" Lower="100" Upper="200" />
                <TraitChangeCondition What="Agility" Lower="33" Upper="66" />
            </TraitChangeAmount>
            <Text>Performing in action scenes makes ${name} a really Cool Person.</Text>
        </GainTrait>

        <GainTrait Trait="Sexy Air" >
            <TraitChangeAmount Value="40" Chance="25">
                <TraitChangeCondition What="JobPerformance" Lower="150" Upper="200" />
            </TraitChangeAmount>
            <Text>${name} has been having to be sexy for so long she now reeks Sexiness.</Text>
        </GainTrait>
    </Gains>

    <Messages>
        <Message Name="work">
            <Text>${name} worked as an actress in an action scene.</Text>
        </Message>
        <Message Name="refuse">
            <Text>${name} refused to shoot an action scene today.</Text>
        </Message>
        <Message Name="story">
            <Text>in which she battles a gang of demons.</Text>
            <Text>in which she defends a village against twisted, raping marauders.</Text>
            <Text>in which she avenges her mentor and defends her family's honour.</Text>
            <Text>in which she battles her evil step-brother for control of the Crimson Sceptre.</Text>
            <Text>in which she saves a twisted nunnery from the evil within.</Text>
            <Text>in which she opens hella whup-ass.</Text>
            <Text>in which she protects the Elven Princess from the Orc Prince's evil magics.</Text>
            <Text>in which she struggles to survive an island deathmatch sponsored by a corrupt state.</Text>
            <Text>in which she dies unfairly, and is forced to beat the Challenge of the Eight Divines to earn back her place among the living.</Text>
            <Text>in which she protects a handsome, kindly slave-master from his slaves' vicious mutiny.</Text>
            <Text>in which she is a bounty hunter, hunting down desperate criminals and dangerous escaped slaves.</Text>
            <Text>in which she battles her older sister who has been corrupted by the dark power of the Ninth Ward of Amocles.</Text>
            <Text>in which she is the last of a race of female warriors, taking vengeance against a dark Prince.</Text>
            <Text>in which she stars as a female monk defending a mountain temple from marauding Centaurs.</Text>
            <Text>in which she hunts down the sadistic pirate gang who kidnapped her sister.</Text>
        </Message>

        <Message Name="summary.like">
            <Text>She loved performing on film today.</Text>
        </Message>
        <Message Name="summary.neutral">
            <Text>She enjoyed this performance.</Text>
        </Message>
        <Message Name="summary.dislike">
            <Text>She found this awkward and did not enjoy it.</Text>
        </Message>
    </Messages>
</Job>
