<!DOCTYPE Job SYSTEM "job.dtd">
<Job ShortName="FChf">
    <Description>
        She will be filmed preparing food. And talking slowly. Sensuously. In sexy outfits. Because no reason.
    </Description>
    <Performance Modifier=".performance">
        <Factor Stat="Charisma" Weight="2"/>
        <Factor Stat="Beauty" Weight="1"/>
        <Factor Stat="Confidence" Weight="1"/>
        <Factor Skill="Performance" Weight="2"/>
        <Factor Skill="Cooking" Weight="1"/>

        <Mod>work.actress</Mod>

        <!-- good traits -->
        <Trait Name="Chef" Value="40"/>    <!-- Good at cooking -->
        <Trait Name="Mixologist" Value="20"/>  <!-- Good with measures -->
        <Trait Name="Charismatic" Value="25"/> <!-- Charisma on film -->
        <Trait Name="Sexy Air" Value="25"/>
        <Trait Name="Charming" Value="20"/>
        <Trait Name="Cool Person" Value="10"/>
        <Trait Name="Social Drinker" Value="5"/>   <!-- Drinks too -->
        <Trait Name="Exhibitionist" Value="30"/>   <!-- Shows off body -->
        <Trait Name="MILF" Value="15"/>    <!-- Attractive to some -->
        <Trait Name="Cute" Value="10"/>
        <Trait Name="Lolita" Value="10"/>
        <Trait Name="Elegant" Value="10"/>
        <Trait Name="Exotic" Value="5"/>
        <Trait Name="Beauty Mark" Value="5"/>
        <Trait Name="Fat" Value="10"/> <!-- Likes food -->
        <Trait Name="Plump" Value="5"/>
        <Trait Name="Wide Bottom" Value="5"/>
        <Trait Name="Plump Tush" Value="5"/>


        <!-- bad traits -->
        <Trait Name="Nervous" Value="-30"/>    <!-- weakens performance -->
        <Trait Name="Meek" Value="-20"/>
        <Trait Name="Shy" Value="-20"/>
        <Trait Name="One Arm" Value="-20"/>
        <Trait Name="One Hand" Value="-10"/>
        <Trait Name="No Arms" Value="-50"/>    <!-- hard to strip -->
        <Trait Name="No Hands" Value="-50"/>
        <Trait Name="Alcoholic" Value="-5"/>
    </Performance>

    <Gains XP="15" Skill="3">
        <Skill Name="Performance" Weight="2" />
        <Skill Name="Cooking" Weight="1" Max="50"/>
        <Stat Name="Charisma" Weight="1" />

        <GainTrait Trait="Actress" >
            <TraitChangeAmount Value="40" Chance="50">
                <TraitChangeCondition What="JobPerformance" Lower="100" Upper="200" />
            </TraitChangeAmount>
            <Text> Working on camera has improved her Acting skills.</Text>
        </GainTrait>

        <GainTrait Trait="Charming" >
            <TraitChangeAmount Value="40" Chance="33">
                <TraitChangeCondition What="JobPerformance" Lower="100" Upper="200" />
            </TraitChangeAmount>
            <Text>She has become quite Charming.</Text>
        </GainTrait>

        <GainTrait Trait="Chef" >
            <TraitChangeAmount Value="40" Chance="33">
                <TraitChangeCondition What="Cooking" Lower="40" Upper="80" />
            </TraitChangeAmount>
            <Text>${name} has become a competent Chef.</Text>
        </GainTrait>

        <GainTrait Trait="Sexy Air" >
            <TraitChangeAmount Value="40" Chance="25">
                <TraitChangeCondition What="JobPerformance" Lower="150" Upper="200" />
            </TraitChangeAmount>
            <Text>${name} has been having to be sexy for so long she now reeks Sexiness.</Text>
        </GainTrait>

        <GainTrait Trait="Idol" >
            <TraitChangeAmount Value="33" Chance="20">
                <TraitChangeCondition What="JobPerformance" Lower="100" Upper="200" />
                <TraitChangeCondition What="Fame" Lower="50" Upper="100" />
            </TraitChangeAmount>
            <Text>${name} has become an Idol, adored by her fans and followers.</Text>
        </GainTrait>
    </Gains>

    <Config PrimaryAction="Performing" SecondaryAction="Cooking">
    </Config>

    <Messages>
        <Message Name="work">
            <Text>${name} worked filming sexy chef scenes to educate and entertain viewers.</Text>
        </Message>
        <Message Name="refuse">
            <Text>${name} refused to make a kitchen show today.</Text>
        </Message>

        <Message Name="work.perfect">
            <Text>${name} created an outstanding show.
                She's so competent and flirtatious that the show is a hit with everyone.</Text>
        </Message>
        <Message Name="work.great">
            <Text>
                ${name} created a great show. Women are impressed with her competence.
                Men are impressed with her... competence. It doesn't hurt that she's hot and flirtatious.
            </Text>
        </Message>
        <Message Name="work.good">
            ${name} created a good show.
            <Text Condition="skill:Cooking>=stat:Beauty">Her skills in the kitchen are enough to carry the show.</Text>
            <Text Condition="skill:Cooking<=stat:Beauty">She's sexy enough that her fumbles in the kitchen go mostly unnoticed.</Text>
        </Message>
        <Message Name="work.ok">
            ${name} created an okay cooking show.
            <Text Condition="skill:Cooking>=stat:Beauty">She was skilled enough in the kitchen to mostly entertain.</Text>
            <Text Condition="skill:Cooking<=stat:Beauty">She's cute, so it doesn't really matter that she can't cook.</Text>
        </Message>
        <Message Name="work.bad">
            ${name} created a bad cooking show.
            <Text Condition="skill:Cooking>=stat:Beauty">The little skill she had in the kitchen wasn't nearly enough to save it.</Text>
            <Text Condition="skill:Cooking<=stat:Beauty">
                Perhaps if she'd quit breaking all the utensils and had instead taken her clothes off it would've been worth watching.
                Perhaps.
            </Text>
        </Message>
        <Message Name="work.worst">
            <Text>
                ${name} created a really bad cooking show.
                She had no charisma and burned or broke basically everything she touched. It was almost funny.
                Almost.
            </Text>
        </Message>
    </Messages>
</Job>
